Headlines,Dates
Elon Musk On Tesla's Autonomous Tech: Our Data Advantage Is Hard To Overcome,2/21/2019
Nio Could Be Tesla's Biggest Threat,2/20/2019
Tesla Model 3 Leasing: Sooner Or Later?,2/20/2019
Tesla 10-K: Some Curious Items,2/19/2019
Tesla's 10-K Suddenly Reveals Regulatory Approval Uncertainty For The China Factory,2/19/2019
Tesla: Overvalued After Q4 Earnings Announcement,2/18/2019
Tesla: The Importance Of A Chinese Gigafactory,2/18/2019
Government Pressure Mounts On Tesla's Struggling Solar Unit,2/14/2019
3 Important Things You Might Have Missed On Tesla's Q4 Earnings Call,2/14/2019
Why Tesla's Model 3 Price Cuts Aren't About Demand,2/14/2019
Tesla Model 3 Drives Off The Demand Cliff,2/13/2019
Has Model 3 Demand Really Collapsed In The U.S.? Ask Tesla,2/13/2019
Tesla Short Squeeze Chances Fall,2/13/2019
Tesla Bears Retreat,2/12/2019
Tesla: Promoted To A 'Favorite' Short,2/12/2019
Tesla 2019 Starting Very Slowly,2/11/2019
Tesla: Weak Model 3 Demand In Europe And China May Widen Losses In 2019,2/8/2019
Tesla's Perplexing Pricing,2/7/2019
Tesla's Solar Business Is Falling Apart,2/7/2019
Tesla's Largest Competitive Advantage,2/6/2019
A Closer Look At The Tesla - Maxwell Technologies Deal,2/5/2019
Tesla: Dog And Pony Show,2/5/2019
Tesla: Cash Coming Into Focus,2/5/2019
China Project Integral To Tesla's Future,2/5/2019
Tesla: Q4 Invalidates The Bull Thesis,2/5/2019
Tesla's Bright Outlook In 2019,2/5/2019
Valuing Tesla Based On Vehicle Sales And Autonomy,2/5/2019
Tesla Still Stuck In The Mud In China,2/4/2019
"Heads, Tesla Wins",2/4/2019
"Norway's BEV Market Grew 40% In January, But Tesla's Sales Fell 13%",2/4/2019
Stanphyl Capital Letter - January 2019,2/3/2019
Tesla Solar Shenanigans Continue,2/1/2019
Tesla's 2018 Ideology Shift,2/1/2019
The Many Puzzling Non-Answers Tesla Provided On The Conference Call,1/31/2019
Tesla: Unsettling Comments From The Earnings Call,1/31/2019
3 Key Things On The Tesla Numbers,1/31/2019
Tesla: Q4 Validates The Bull Thesis,1/31/2019
Tesla Q4 Raises Growth Concerns,1/31/2019
Tesla Stock: Wake Up And Sell The Reality,1/30/2019
Tesla: The Powerpack Business And Competing Technologies,1/30/2019
The Tesla Killers Are Finally Here,1/29/2019
Tesla Bears Beware,1/29/2019
Tesla: Here's Why I Just Increased My Position By 42%,1/28/2019
Tesla Earnings: 3 Major Questions,1/28/2019
Tesla's $920 Million Convertible - The Options Have Shrunk,1/28/2019
3 Myths About Tesla That Need To Be Squashed,1/28/2019
Tesla May Not Make It Past Q1 Without Vendor Concessions Or A Capital Raise,1/25/2019
Battery Supply And Energy Storage Are Central To Tesla's Future,1/24/2019
Tesla's Almost Useless Order Percentage 'Factoid',1/24/2019
Tesla Nearing March Debt Maturity,1/24/2019
Tesla: End Of Customer Referral Program Weakens Bull Case,1/23/2019
Tesla: The Tale Of Vehicle Registrations Continues,1/23/2019
Tesla: Reality Sets In,1/23/2019
Tesla's Solar Asset Performance Will Ultimately Determine VIE Cash Flows,1/23/2019
Tesla: Was The Selloff An Overreaction?,1/23/2019
Is Tesla Special?,1/23/2019
Battery Tech: Is Panasonic Leaving Tesla In The Dust?,1/22/2019
Tesla Raises Supercharger Prices 19% - Now Twice As Expensive As A Toyota Hybrid,1/22/2019
Tesla Customers Just Keep Losing,1/22/2019
Tesla's Supercharger Network: A Significant Competitive Advantage That's Rapidly Evaporating,1/22/2019
Tesla: A Difficult Road Ahead Or The End Of The Road?,1/22/2019
Elon Musk Has Buried The Tesla Growth Narrative,1/22/2019
Tesla Inc.: Poor Analysis Of VIE Exposure Is Misleading; Quick Comment On Layoffs,1/20/2019
Tesla: We Have A Problem,1/18/2019
Why Tesla Will Continue To Lead EV Sales For The Foreseeable Future,1/15/2019
Tesla: Where's The Twitter Monitor?,1/14/2019
Tesla's Day Of VIE Reckoning Approaches,1/14/2019
Volkswagen's Electricity Price Undercuts Tesla's Superchargers By 35% To 66%,1/14/2019
"East 72 Quarterly Report Period To December 31, 2018",1/14/2019
Why Tesla Will Likely Achieve New All-Time Highs In 2019,1/11/2019
Tesla: Another Shakeup,1/10/2019
Tesla: Major Q1 Delivery Miss Seems Likely,1/10/2019
"BYD, Tesla Chasing Different E-Truck Dreams",1/9/2019
Stanphyl Capital Letter - December 2018,1/8/2019
Tesla: These Numbers Aren't Good,1/8/2019
Tesla Massively Delays U.S. Title Registrations For Its Cars,1/7/2019
Is Tesla Allowed To Sell The Model 3 In Europe?,1/7/2019
Tesla: Model 3 Demand Cliff In Sight,1/7/2019
Tesla Q4 $641 Million Net Profit Estimate And Possible Model Y Factory,1/3/2019
"Tesla: Unsold Model 3s Climb To 7,000-Plus",1/2/2019
Tesla: Institutional Investors Return,1/2/2019
Tesla: Q4 Deliveries Fall Short,1/2/2019
Tesla: The Autonomy Thesis,1/2/2019
The Tesla Growth Narrative Quietly Winds Down,12/31/2018
Tesla: Demand Pull-Forward Risk,12/31/2018
Tesla Offers To Forgive Your Lease Payments If You Take Delivery By Dec. 31,12/31/2018
Tesla Q4 2018 Delivery Preview,12/30/2018
Tesla Should Have No Problem Sustaining Demand,12/28/2018
"Tesla Stock: Irrational Exuberance With Staying Power, For Now",12/28/2018
"Tesla Down 40% In Norway's Q4, 63% Of Which Explained By Jaguar",12/27/2018
Tesla: Why Trust Elon Musk Now?,12/27/2018
Tesla Hits A Wall In China,12/26/2018
Tesla: Long-Time Bullish Analyst Flashes Warning Signs,12/19/2018
Will Tesla Build Model Y In Lathrop?,12/18/2018
Tesla Questions To Be Answered,12/18/2018
"Tesla: Musk Doesn't Respect The SEC, But Bondholders Don't Respect Musk",12/17/2018
"Tesla Model 3 Gets Formidable Challenger In $37,495 Hyundai Kona EV SUV",12/17/2018
Model 3's Path To Segment Domination,12/17/2018
Tesla's Model 3 Sales Now Face Uphill Battle As U.S. Backlog Appears Exhausted And Tax Credit Is Expiring,12/17/2018
Tesla: Quick Look At The 2019 Convertible Settlement,12/15/2018
Tesla Likely To Miss Sales Targets For Model 3,12/14/2018
Tesla: An Unlikely Beacon Of Light In A Very Stormy Market,12/13/2018
How Will Tesla's Model 3 Fare In 2019?,12/13/2018
"Tesla To 90,000: Delivery Forecasts For The Fourth Quarter",12/12/2018
Projecting Tesla's Fourth Quarter Results: Boom Or Bust?,12/12/2018
Tesla: A Costly Legal Battle?,12/11/2018
Elon Musk On 60 Minutes: More Than An SEC Fight,12/11/2018
Tesla: The 60 Minutes Scare,12/10/2018
Tesla: More Margin Pressure On The Horizon,12/6/2018
Tesla: The Short Thesis Is Dying,12/6/2018
A Tale Of Two Teslas,12/5/2018
"Tesla: $35,000 Model 3 Still Out Of Reach",12/3/2018
Tesla Model 3 Production Burst Is Not Sustainable,12/3/2018
Tesla Bonds Telling Different Story,11/29/2018
Steep Road Ahead For Tesla To Justify The Premium Valuation,11/28/2018
"Tesla: Brass Ring Grasped, But Not Secured",11/28/2018
Why I'm Selling Tesla Shares,11/28/2018
Tesla: Revisiting The Threat Of Competition,11/27/2018
"Yes, Tesla Is Fairly Valued",11/27/2018
Tesla: Winter Is Coming,11/26/2018
Elon Musk Admits Tesla Was Weeks Away From 'Dying' - 13 Questions He Must Now Answer,11/26/2018
Tesla Spends Thanksgiving In Production Hell,11/26/2018
Tesla Mystery Shopper Report: Model 3 Version,11/26/2018
Tesla: The Nature Of European End-Of-Quarter Bursts,11/26/2018
The Logical Extrapolation From Tesla's Price Cut In China?,11/23/2018
Why Hardware 3 Is Tesla's Dark Horse,11/22/2018
Artko Capital Q3 2018 Commentary,11/22/2018
Tesla Stellar Run Limits Further Upside,11/21/2018
The New 39 MPG Toyota SUV Vs. Tesla Model 3: Same Fuel Cost Per Mile,11/20/2018
Tesla Wants To Make Model 3 The Top-Selling Sedan In December,11/20/2018
Tesla Delays Are Piling Up,11/20/2018
The Good Ship Tesla Is Sailing Into The Perfect Storm,11/20/2018
Tesla: Did Someone Fail Math?,11/15/2018
"It's Not Just Norway: Jaguar's Electric Car Is Beating Tesla In Other European Countries, Too",11/13/2018
Norway Goes Cold On Tesla This Winter,11/12/2018
